{
  "$schema": "urn:riichi-engine-protocol:schema:engine-manifest:v1",
  "schemaVersion": 1,
  "id": "third-party.example-decision",
  "name": "参考决策引擎",
  "version": "1.0.0",
  "protocol": {
    "name": "riichi-engine-protocol",
    "major": 1,
    "minor": 0
  },
  "kinds": [
    "decision"
  ],
  "entrypoints": {
    "windows-x64": {
      "executable": "runtime/mock-engine.exe",
      "arguments": []
    }
  },
  "modelFormats": [
    {
      "id": "example-decision-model",
      "extensions": [
        ".bin"
      ],
      "inputSchema": "mjai-events-v1",
      "outputSchema": "decision-v1"
    }
  ],
  "capabilities": {
    "multipleSessions": true,
    "incrementalHistory": false,
    "concurrentRequests": false,
    "cancellation": false,
    "reload": true,
    "rawValues": true,
    "probabilities": true
  },
  "optionsSchema": {
    "type": "object",
    "properties": {}
  }
}
